{
  "$comment": "Sidecar template for value-review.md. This is the AUTHORITATIVE machine-readable output. Generated by value-first-gate alongside value-review.md. triadev reads this file (not the markdown) to populate triadev-handoff.json value_gate fields.",
  "schema_version": "2.0",
  "proposal": "",
  "generated_at": "",
  "owner": "",
  "verdict": "REVISE",
  "total_score": 0,
  "confidence": "Low",
  "per_criterion_scores": {
    "user_impact": 0,
    "strategic_fit": 0,
    "urgency": 0,
    "evidence_strength": 0,
    "effort_efficiency": 0,
    "risk_controllability": 0
  },
  "critique_caps_applied": [],
  "anti_patterns_flagged": [],
  "devils_advocate": "",
  "rubber_stamp_flags": {
    "score_spread_zero": false,
    "evidence_cells_empty_count": 0,
    "devils_advocate_empty": false,
    "critique_unclear_count": 0,
    "anti_patterns_all_silent": false,
    "any_triggered": false
  },
  "score_spread": 0,
  "review_path": "",
  "previous_reviews": [],
  "preconditions_to_change_verdict": "",
  "next_action_48h": {
    "action": "",
    "owner": "",
    "expected_signal": "",
    "re_evaluation_date": ""
  }
}
