{
  "$comment": "Legitimate GO sidecar. All rubber-stamp flags false.",
  "schema_version": "2.0",
  "proposal": "Add --voice bob personal style injection to humanizer skill (v1.1)",
  "generated_at": "2026-04-16T10:20:00",
  "owner": "Bob",
  "verdict": "GO",
  "total_score": 24,
  "confidence": "Medium",
  "per_criterion_scores": {
    "user_impact": 4,
    "strategic_fit": 5,
    "urgency": 3,
    "evidence_strength": 4,
    "effort_efficiency": 5,
    "risk_controllability": 3
  },
  "critique_caps_applied": [
    {"dimension": "urgency", "reason": "Cost of inaction is small (~2 hr/quarter)"}
  ],
  "anti_patterns_flagged": ["single_stakeholder_capture"],
  "devils_advocate": "Personal tooling scope-creeps into over-engineering. A profile with 10 patterns is already more than needed for most outputs; adding another maintenance burden may exceed the ~2 hr/quarter it saves. The GO verdict accepts this tradeoff because reused infrastructure keeps marginal cost low.",
  "rubber_stamp_flags": {
    "score_spread_zero": false,
    "evidence_cells_empty_count": 0,
    "devils_advocate_empty": false,
    "critique_unclear_count": 0,
    "anti_patterns_all_silent": false,
    "any_triggered": false
  },
  "score_spread": 2,
  "review_path": "value-review.md",
  "previous_reviews": [],
  "preconditions_to_change_verdict": "If blind test <50% preferred, downgrade to REVISE and rework pattern taxonomy.",
  "next_action_48h": {
    "action": "Implement voice-profile-bob.md with 10 patterns + --voice flag in SKILL.md",
    "owner": "Bob",
    "expected_signal": "3 before/after examples in examples/ directory, blind-preferred >= 2/3",
    "re_evaluation_date": "2026-04-17"
  }
}
